estimate,percentage,people
Adult population,,"44,456,850"
Adult population forecast at 2026/27,,"46,263,200"
Incidence of breast cancer,0.001088336,"50,350"
Proportion of people with early or locally advanced disease,0.871,"43,855"
"Proportion of people with hormone receptor positive, HER2 negative disease",0.645,"28,286"
Proportion of people with high-risk disease,0.25,"7,072"
Eligible population at high risk of recurrence,0.574,"4,059"
Treatment population- People who choose abemaciclib with endocrine therapy (year 5 - 2027),0.55,"2,232"
